Section,Details
Overall,"{'output_text': ""Google is a multinational technology company that specializes in internet-related services and products. It was founded in 1998 by Larry Page and Sergey Brin while they were Ph.D. students at Stanford University. Google's mission is to organize the world's information and make it universally accessible and useful.\n\nGoogle offers a wide range of services, including search engine, online advertising, cloud computing, software, and hardware. The company's flagship product is its search engine, which is used by billions of people around the world to find information on the internet. Google also operates the Android operating system, the most widely used mobile operating system globally.\n\nGoogle exists to provide users with access to information, connect people through its communication tools, and empower businesses with its advertising and cloud computing services. The company's innovative technologies and products have revolutionized the way we access information, communicate, and conduct business online.""}"
Target users,"{'output_text': ""Google is intended for a wide range of users, including individuals, businesses, organizations, and developers. The target users of Google's services and products can be categorized as follows:\n\n1. Individuals: Google's search engine, Gmail, Google Maps, YouTube, and other consumer-facing products are designed for individual users to access information, communicate, navigate, watch videos, and more.\n\n2. Businesses: Google offers advertising services through Google Ads, cloud computing services through Google Cloud Platform, productivity tools through G Suite, and analytics tools through Google Analytics, targeting businesses of all sizes to help them grow and succeed online.\n\n3. Organizations: Non-profit organizations, educational institutions, government agencies, and other organizations can benefit from Google's services for communication, collaboration, data storage, and information sharing.\n\n4. Developers: Google provides tools and platforms for developers to build and deploy applications, such as Google Cloud Platform, Firebase, Android Studio, and APIs for various services like Google Maps and YouTube.\n\nOverall, Google's target users encompass a broad spectrum of individuals, businesses, organizations, and developers who can leverage its technology and services to enhance their online experiences, productivity, and success.""}"
Problems,"{'output_text': ""Target users seek out and adopt Google for a variety of reasons, including:\n\n1. Access to Information: Google is known for its powerful search engine, which allows users to quickly find information on a wide range of topics. This makes it a valuable tool for research, learning, and staying informed.\n\n2. Communication: Google offers a range of communication tools, such as Gmail, Google Meet, and Google Chat, that make it easy for users to connect with others through email, video calls, and messaging.\n\n3. Productivity: Google's suite of productivity tools, including Google Docs, Sheets, and Slides, enable users to create, edit, and collaborate on documents, spreadsheets, and presentations in real-time.\n\n4. Cloud Computing: Google Cloud Platform provides users with access to scalable and secure cloud computing services, allowing businesses to build and deploy applications, store data, and run workloads in the cloud.\n\n5. Advertising: Google Ads is a popular advertising platform that helps businesses reach their target audience through online ads displayed on Google's search results and partner websites.\n\n6. Developer Tools: Google offers a range of tools and platforms for developers, such as Firebase, Android Studio, and APIs for various services, to help them build and deploy applications for mobile, web, and cloud environments.\n\nOverall, target users adopt Google for its comprehensive suite of services, innovative technology, ease of use, and reliability, which help them achieve their goals, whether it's finding information, communicating with others, increasing productivity, or building and deploying applications.""}"
Solutions,"{'output_text': ""Google addresses each of these reasons through its various products and services:\n\n1. Access to Information: Google's search engine uses advanced algorithms to provide users with relevant and accurate search results. Additionally, Google offers services like Google News, Google Scholar, and Google Books to help users access a wide range of information sources.\n\n2. Communication: Google provides Gmail for email communication, Google Meet for video conferencing, and Google Chat for instant messaging. These tools are user-friendly, secure, and integrated with other Google services for seamless communication.\n\n3. Productivity: Google's suite of productivity tools, including Google Docs, Sheets, and Slides, are cloud-based and allow for real-time collaboration. Users can easily create, edit, and share documents, spreadsheets, and presentations with others.\n\n4. Cloud Computing: Google Cloud Platform offers a range of cloud computing services, including computing power, storage, and databases. Users can easily deploy and scale applications, store and analyze data, and access machine learning tools on Google Cloud Platform.\n\n5. Advertising: Google Ads provides a platform for businesses to create and manage online advertising campaigns. With Google Ads, businesses can target specific audiences, track ad performance, and optimize their advertising strategies to reach their marketing goals.\n\n6. Developer Tools: Google offers a variety of tools and platforms for developers to build and deploy applications. Firebase provides a comprehensive platform for app development, Android Studio is a powerful IDE for building Android apps, and Google APIs enable developers to integrate Google services into their applications.\n\nOverall, Google addresses each of these reasons by providing user-friendly, innovative, and reliable products and services that meet the needs of its users and help them achieve their goals.""}"
Unfair advantage,"{'output_text': ""Google is difficult to compete with for several reasons:\n\n1. Brand Recognition: Google is one of the most recognizable and trusted brands in the world. Its name has become synonymous with internet search, online advertising, and cloud computing. Competing with such a well-established brand can be challenging for other companies.\n\n2. Vast Resources: Google has vast financial resources, top-tier talent, and cutting-edge technology at its disposal. This allows the company to invest in research and development, acquire innovative startups, and continuously improve its products and services.\n\n3. Network Effects: Google's products and services benefit from network effects, where the value of the platform increases as more users join. For example, Google Search becomes more useful as more people use it, leading to a self-reinforcing cycle that makes it difficult for competitors to catch up.\n\n4. Data and AI Capabilities: Google has access to massive amounts of data from its users, which it leverages to improve its products and services. The company also has advanced artificial intelligence and machine learning capabilities, giving it a competitive edge in areas like search, advertising, and cloud computing.\n\n5. Ecosystem Integration: Google has built a vast ecosystem of interconnected products and services, such as Gmail, Google Drive, Google Maps, and YouTube. This integration makes it convenient for users to access multiple services within the Google ecosystem, creating stickiness and loyalty.\n\n6. Regulatory Challenges: Google's dominance in various markets has attracted regulatory scrutiny and antitrust investigations. This regulatory environment can make it difficult for competitors to enter or compete effectively in certain markets where Google has a strong presence.\n\nOverall, the combination of brand recognition, vast resources, network effects, data and AI capabilities, ecosystem integration, and regulatory challenges makes Google a formidable competitor that is difficult to surpass.""}"
Unique value proposition,"{'output_text': ""Google is unique and special compared to others for several reasons:\n\n1. Innovation: Google is known for its innovative approach to technology and its ability to push boundaries in various fields, such as search, artificial intelligence, cloud computing, and more. The company constantly introduces new products and services that have a significant impact on the industry.\n\n2. Data-driven: Google leverages its vast amounts of data to improve its products and services, personalize user experiences, and drive business decisions. The company's data-driven approach sets it apart from competitors and allows it to deliver more relevant and effective solutions.\n\n3. User-centric: Google prioritizes user experience and focuses on creating products that are intuitive, user-friendly, and accessible to a wide range of users. This user-centric approach has helped Google build a loyal customer base and maintain its position as a leader in the tech industry.\n\n4. Global reach: Google operates on a global scale, with a presence in multiple countries and languages. Its products and services are used by billions of people around the world, making it a truly global company with a far-reaching impact.\n\n5. Diverse portfolio: Google offers a diverse portfolio of products and services, ranging from search and advertising to cloud computing, hardware, and more. This diverse range of offerings allows Google to cater to a wide range of user needs and stay competitive in various markets.\n\n6. Corporate culture: Google is known for its unique corporate culture, which emphasizes creativity, collaboration, and a focus on employee well-being. The company's work environment and values have helped attract top talent and foster a culture of innovation and excellence.\n\nOverall, Google's combination of innovation, data-driven approach, user-centric focus, global reach, diverse portfolio, and unique corporate culture make it a standout company in the tech industry.""}"
Channels,"{'output_text': ""Google uses a variety of channels to reach its target users, including:\n\n1. Search Engine: Google's primary channel for reaching users is its own search engine. By optimizing search results and displaying ads, Google can reach users who are actively searching for information, products, or services.\n\n2. Display Advertising: Google also uses display advertising on its network of websites and partner sites to reach users with targeted ads based on their interests and browsing behavior.\n\n3. YouTube: As a subsidiary of Google, YouTube is a key channel for reaching users through video content. Google leverages YouTube for advertising, content marketing, and engaging with users through tutorials, product demos, and more.\n\n4. Google Ads: Google's advertising platform allows businesses to create and display ads across various channels, including search, display, video, and mobile. This platform helps Google reach its target users and generate revenue through advertising.\n\n5. Google Maps: Google Maps is another channel that Google uses to reach users, especially those looking for location-based information, directions, and local businesses. Google can display ads and promotions within Google Maps to target users based on their location.\n\n6. Gmail: Google's email service, Gmail, is used to reach users through targeted email campaigns, promotions, and personalized content. Google can leverage user data from Gmail to deliver relevant messages to its target audience.\n\n7. Social Media: Google also utilizes social media channels, such as Google My Business, Google+ (now discontinued), and other platforms, to engage with users, share updates, and promote its products and services.\n\nOverall, Google employs a multi-channel approach to reach its target users, leveraging its own platforms, advertising networks, and partnerships to connect with users across various touchpoints.""}"
Costs,"{'output_text': ""Google incurs various operating costs to maintain its operations and provide its services. Some of the key operating costs incurred by Google include:\n\n1. Infrastructure Costs: Google operates a vast network of data centers and servers to support its services, such as Google Search, Gmail, Google Cloud Platform, and YouTube. The costs associated with building, maintaining, and upgrading this infrastructure are significant.\n\n2. Employee Expenses: Google has a large workforce of employees, including engineers, developers, sales and marketing professionals, and support staff. Employee salaries, benefits, training, and other related expenses contribute to the operating costs of the company.\n\n3. Research and Development: Google invests heavily in research and development to innovate and improve its products and services. The costs associated with R&D activities, such as developing new technologies, improving algorithms, and launching new features, are part of the operating expenses.\n\n4. Marketing and Advertising: Google spends a significant amount on marketing and advertising to promote its products and services, attract new users, and retain existing customers. This includes online advertising, partnerships, events, and other promotional activities.\n\n5. Legal and Regulatory Expenses: Google faces legal challenges, regulatory compliance requirements, and lawsuits related to antitrust, privacy, intellectual property, and other issues. Legal fees, settlements, and compliance costs contribute to the operating expenses.\n\n6. General and Administrative Costs: Google incurs general and administrative expenses, such as office rent, utilities, insurance, professional services, and other overhead costs to support its day-to-day operations.\n\nOverall, Google's operating costs are diverse and include a range of expenses related to infrastructure, employees, R&D, marketing, legal, and administrative activities. These costs are necessary to sustain the company's operations, drive innovation, and maintain its competitive position in the market.""}"
Revenue,"{'output_text': ""Google generates revenue primarily through its advertising business, which accounts for the majority of its income. Here are some key ways in which Google generates revenue:\n\n1. Advertising: Google's main source of revenue comes from its advertising platforms, such as Google Ads and AdSense. Advertisers pay Google to display their ads on search results pages, websites, and other platforms. Google uses a pay-per-click model, where advertisers pay only when users click on their ads.\n\n2. Google Cloud Platform: Google offers cloud computing services through its Google Cloud Platform (GCP). Businesses and developers pay for cloud storage, computing power, and other services provided by GCP. This includes services like Google Compute Engine, Google Cloud Storage, and Google Kubernetes Engine.\n\n3. Hardware: Google also generates revenue from the sale of hardware products, such as Pixel smartphones, Google Home smart speakers, and Nest smart home devices. These products are sold directly to consumers through online and retail channels.\n\n4. Play Store and YouTube: Google earns revenue from digital content sales on the Google Play Store, including apps, games, movies, and music. Additionally, Google generates revenue from advertising on YouTube, the popular video-sharing platform owned by Google.\n\n5. Licensing and Other Services: Google also generates revenue through licensing agreements with partners, such as device manufacturers that use Google's Android operating system. Google offers other services, such as Google Workspace (formerly G Suite), which provides productivity tools for businesses.\n\nOverall, Google's diverse revenue streams, with a strong focus on advertising, cloud services, hardware, digital content, and other offerings, contribute to its financial success and profitability.""}"
